{
  "schema_version": "1.0.0",
  "recommendation_id": "DEMO-REC-001",
  "created_at": "2026-09-19T14:40:00Z",
  "priority": 1,
  "action": "DIVERT_AMBULANCES",
  "target": {
    "entity_type": "road",
    "entity_id": "DEMO-ROAD-101",
    "description": "Arterial Bridge Corridor East blocked by 95cm flood water."
  },
  "reasoning": "Primary arterial crossing is impassable. Divert inbound emergency triage convoys to Northern Secondary Bypass.",
  "factors": [
    {
      "name": "water_depth_threshold",
      "weight": 0.55,
      "description": "Measured water depth 95cm exceeds 30cm emergency vehicle clearance limit."
    },
    {
      "name": "hospital_accessibility",
      "weight": 0.45,
      "description": "Bypass route provides viable link to District General Trauma Hospital."
    }
  ],
  "confidence": 0.92,
  "uncertainty": {
    "lower_bound": 0.88,
    "upper_bound": 0.95,
    "metric": "calibrated_beta_interval"
  },
  "source_state_version": "state-v104",
  "requires_human_approval": true,
  "approval_status": "PENDING"
}
